{
  "business_actions_executed": false,
  "cases": [
    {
      "case_class": "normal",
      "case_id": "D11-PREFLIGHT-01",
      "difference_disposition": "not_required",
      "evidence_refs": [
        "synthetic://D11/legacy/D11-PREFLIGHT-01",
        "synthetic://D11/f01/D11-PREFLIGHT-01"
      ],
      "f01_result": {
        "allowed_actions": [
          "review"
        ],
        "claim_class": "descriptive",
        "grade_label": "CE2",
        "numeric_value": 1.0,
        "scope_key": "US|SIMULATED|D11|2026-08"
      },
      "legacy_result": {
        "allowed_actions": [
          "review"
        ],
        "claim_class": "descriptive",
        "grade_label": "CE2",
        "numeric_value": 1.0,
        "scope_key": "US|SIMULATED|D11|2026-08"
      },
      "snapshot_hash": "522145f8ee92d6426f8a4ebd87958cf7d05e5e2b292cfa6d19d76e6bd9f48073"
    },
    {
      "case_class": "near_decision_threshold",
      "case_id": "D11-PREFLIGHT-02",
      "difference_disposition": "not_required",
      "evidence_refs": [
        "synthetic://D11/legacy/D11-PREFLIGHT-02",
        "synthetic://D11/f01/D11-PREFLIGHT-02"
      ],
      "f01_result": {
        "allowed_actions": [
          "review"
        ],
        "claim_class": "descriptive",
        "grade_label": "CE2",
        "numeric_value": 1e-09,
        "scope_key": "US|SIMULATED|D11|2026-08"
      },
      "legacy_result": {
        "allowed_actions": [
          "review"
        ],
        "claim_class": "descriptive",
        "grade_label": "CE2",
        "numeric_value": 1e-09,
        "scope_key": "US|SIMULATED|D11|2026-08"
      },
      "snapshot_hash": "7e5993acdb74b25623c49501af0c663652ffdb965a6a40227dfcc09dfe8779ce"
    },
    {
      "case_class": "negative_or_harm",
      "case_id": "D11-PREFLIGHT-03",
      "difference_disposition": "not_required",
      "evidence_refs": [
        "synthetic://D11/legacy/D11-PREFLIGHT-03",
        "synthetic://D11/f01/D11-PREFLIGHT-03"
      ],
      "f01_result": {
        "allowed_actions": [
          "review"
        ],
        "claim_class": "descriptive",
        "grade_label": "CE2",
        "numeric_value": -1.0,
        "scope_key": "US|SIMULATED|D11|2026-08"
      },
      "legacy_result": {
        "allowed_actions": [
          "review"
        ],
        "claim_class": "descriptive",
        "grade_label": "CE2",
        "numeric_value": -1.0,
        "scope_key": "US|SIMULATED|D11|2026-08"
      },
      "snapshot_hash": "faacbb2dbb7a02b45ca0cd52f31b6595e0dc0d71f4b7a3d3753120bf116e3fb2"
    },
    {
      "case_class": "expired",
      "case_id": "D11-PREFLIGHT-04",
      "difference_disposition": "not_required",
      "evidence_refs": [
        "synthetic://D11/legacy/D11-PREFLIGHT-04",
        "synthetic://D11/f01/D11-PREFLIGHT-04"
      ],
      "f01_result": {
        "allowed_actions": [
          "request_recompute"
        ],
        "claim_class": "inconclusive",
        "grade_label": "CE0",
        "numeric_value": null,
        "scope_key": "US|SIMULATED|D11|2026-08"
      },
      "legacy_result": {
        "allowed_actions": [
          "request_recompute"
        ],
        "claim_class": "inconclusive",
        "grade_label": "CE0",
        "numeric_value": null,
        "scope_key": "US|SIMULATED|D11|2026-08"
      },
      "snapshot_hash": "3c689fdba9468114a2a0c029819dea81f5657f3168b66c2dac3b4d66b9e32e39"
    },
    {
      "case_class": "invalidation_triggered",
      "case_id": "D11-PREFLIGHT-05",
      "difference_disposition": "not_required",
      "evidence_refs": [
        "synthetic://D11/legacy/D11-PREFLIGHT-05",
        "synthetic://D11/f01/D11-PREFLIGHT-05"
      ],
      "f01_result": {
        "allowed_actions": [
          "request_recompute"
        ],
        "claim_class": "inconclusive",
        "grade_label": "CE0",
        "numeric_value": null,
        "scope_key": "US|SIMULATED|D11|2026-08"
      },
      "legacy_result": {
        "allowed_actions": [
          "request_recompute"
        ],
        "claim_class": "inconclusive",
        "grade_label": "CE0",
        "numeric_value": null,
        "scope_key": "US|SIMULATED|D11|2026-08"
      },
      "snapshot_hash": "8a9576c5ee7e2f3261c38cc0ffa55ed75fe53e8bc46e9efe0deae080a20c4d96"
    },
    {
      "case_class": "scope_mismatch",
      "case_id": "D11-PREFLIGHT-06",
      "difference_disposition": "not_required",
      "evidence_refs": [
        "synthetic://D11/legacy/D11-PREFLIGHT-06",
        "synthetic://D11/f01/D11-PREFLIGHT-06"
      ],
      "f01_result": {
        "allowed_actions": [],
        "claim_class": "inconclusive",
        "grade_label": "CE0",
        "numeric_value": null,
        "scope_key": "US|SIMULATED|D11|2026-08"
      },
      "legacy_result": {
        "allowed_actions": [],
        "claim_class": "inconclusive",
        "grade_label": "CE0",
        "numeric_value": null,
        "scope_key": "US|SIMULATED|D11|2026-08"
      },
      "snapshot_hash": "3eab93d12fae51c6cf744ce5e6845d5c29f533de7bfbfbb9be3362e6e74b182f"
    },
    {
      "case_class": "missing_required_field",
      "case_id": "D11-PREFLIGHT-07",
      "difference_disposition": "not_required",
      "evidence_refs": [
        "synthetic://D11/legacy/D11-PREFLIGHT-07",
        "synthetic://D11/f01/D11-PREFLIGHT-07"
      ],
      "f01_result": {
        "allowed_actions": [],
        "claim_class": "inconclusive",
        "grade_label": "CE0",
        "numeric_value": null,
        "scope_key": "US|SIMULATED|D11|2026-08"
      },
      "legacy_result": {
        "allowed_actions": [],
        "claim_class": "inconclusive",
        "grade_label": "CE0",
        "numeric_value": null,
        "scope_key": "US|SIMULATED|D11|2026-08"
      },
      "snapshot_hash": "e9331fb23edffda0f54187c7be0bb7ac95659049d644fa2f486be77eb5f490e7"
    }
  ],
  "code_binding": {
    "adapter_hash": "e6403c15a0f060921d15402297addffb2f81f00182cfc7681cc3beca4a216379",
    "contract_hash": "9065c41425ae0ad1b393e42e2bad3aad973f6d69cd3c0b005cfc98b442cce2f0",
    "environment_refs": [
      "local://python-runtime",
      "local://f01-source-tree"
    ],
    "f01_commit_hash": null,
    "f01_source_tree_hash": "f65b2a0ffd95d74b78ae24a228d0efb7b005ddda91ada9e98ad09be1e0ad8bb6",
    "legacy_code_hash": "da824cbb2dc17e64922e90c4f6f603830b9033b73eb3e867004959113ffd5cec",
    "legacy_code_ref": "repository://D11/legacy-assets"
  },
  "data_snapshot": {
    "authorized": true,
    "business_timezone": "Asia/Shanghai",
    "captured_at": "2026-08-10T00:00:00Z",
    "maximum_event_time": "2026-08-09T23:59:59Z",
    "read_only": true,
    "snapshot_hash": "dca420dcf3984e16ec113656b47cfc0877686ce176e7f7c5306047a6831df8de",
    "source_ref": "synthetic://ecae/consumer-preflight/D11"
  },
  "domain_id": "D11",
  "execution_mode": "read_only_shadow_dual_run",
  "external_write": false,
  "frozen_before_results": true,
  "migration_id": "ECAE-CONSUMER-MIGRATION-1.1",
  "numeric_tolerance": 1e-09,
  "owner_assignment": {
    "identity": "Miles Chen",
    "independent_of_ecae_implementation": true,
    "responsibility_accepted": true,
    "role": "D11_consumer_owner"
  },
  "rollback_drill": {
    "blocked_actions_enforced": true,
    "business_write_observed": false,
    "causal_wording_allowed": false,
    "evidence_refs": [
      "synthetic://D11/rollback/expiry"
    ],
    "executed": true,
    "incremental_state": "unknown",
    "recompute_request_created": true,
    "trigger": "expiry"
  },
  "run_class": "fixture_non_production",
  "run_id": "ECAE-CONSUMER-RUN-D11-PREFLIGHT-20260810",
  "schema_version": "1.0.0"
}
